<?xml version="1.0" encoding="UTF-8" ?>
<!ELEMENT zamowienie (adres, artykuly)> 
<!ATTLIST zamowienie numer_zamowienia ID #REQUIRED>

<!ELEMENT adres (miejsce, ulica?, kod_pocztowy)>
<!ATTLIST adres termin_dostarczenia CDATA #IMPLIED>
<!ATTLIST adres kraj CDATA #FIXED "Polska">

<!ELEMENT artykuly (artykul+)>

<!ELEMENT artykul (film|ksiazka|plyta)>
<!ATTLIST artykul id ID #REQUIRED>

<!ELEMENT film (tytul, rezyser, rok_wydania, czas_trwania?)>

<!ELEMENT ksiazka (tytul, autor, rok_wydania, nr_wydania)>

<!ELEMENT plyta (tytul, wykonawca, wydawca, rok_wydania, czas_trwania?)>

<!ELEMENT kod_pocztowy (#PCDATA)>
<!ELEMENT rok_wydania (#PCDATA)>
<!ELEMENT nr_wydania (#PCDATA)>
<!ELEMENT czas_trwania (#PCDATA)>
<!ELEMENT rezyser (#PCDATA)>
<!ELEMENT miejsce (#PCDATA)>
<!ELEMENT ulica (#PCDATA)>
<!ELEMENT tytul (#PCDATA)>
<!ELEMENT wykonawca (#PCDATA)>
<!ELEMENT wydawca (#PCDATA)>
<!ELEMENT autor (#PCDATA)>