<?xml version="1.0" encoding="utf-8"?>
<!DOCTYPE zamowienie SYSTEM "zad6.dtd">
<zamowienie numer_zamowienia="abc123">
    <adres kraj="Polska">
        <miejsce>dom</miejsce>
        <ulica>Jana Bażyńskiego 8</ulica>
        <kod_pocztowy>12-345</kod_pocztowy>
    </adres>
    <artykuly>
        <artykul id="a">
            <film>
                <tytul>Aquaman</tytul>
                <rezyser>Nie wiem</rezyser>
                <rok_wydania>2018</rok_wydania>
                <czas_trwania>spory</czas_trwania>
            </film>
        </artykul>
        <artykul id="b">
            <ksiazka>
                <tytul>Kobieta z wydm</tytul>
                <autor>Abe Kobo</autor>
                <rok_wydania>2010</rok_wydania>
                <nr_wydania>1</nr_wydania>
            </ksiazka>
        </artykul>
        <artykul id="c">
            <plyta>
                <tytul>Chodnikowa</tytul>
                <wykonawca>Ja</wykonawca>
                <wydawca>Pol-Bruk</wydawca>
                <rok_wydania>2019</rok_wydania>
            </plyta>
        </artykul>
    </artykuly>
</zamowienie>